{
  "schema_version": "1.0",
  "product_id": "the-panels-streaming",
  "policy": {
    "blocked_versions": [],
    "emergency_disabled": false,
    "expires_at": "2027-10-12T00:00:00Z",
    "global_emergency_disabled": false,
    "issued_at": "2026-10-12T00:00:00Z",
    "maintenance": {
      "enabled": false,
      "message": "The Panels Streaming is temporarily undergoing maintenance. Please check back shortly."
    },
    "min_version": "1.0.0",
    "revision": 1,
    "user_message": null
  },
  "signature": {
    "algorithm": "ed25519",
    "public_key": "2f029fce662a015a2b13a0e0261eea6fb13aae7ba832e6a4c80f6026ef6b6db7",
    "signature_hex": "9cce09c2d3d7a00b231d50c52d45c21728c7f4b82e401a6045bf2bb25e5fbd64a9afd7936e5142e0ee13df00a7fd15e83a9335edcb0814e32d4d64a7d784f70d"
  }
}