{
  "schema_version": "1.0",
  "product_id": "panels-play",
  "policy": {
    "revision": 9,
    "issued_at": "2026-10-20T00:00:00Z",
    "expires_at": "2027-10-20T00:00:00Z",
    "min_version": "1.2.1",
    "blocked_versions": [],
    "maintenance": {
      "enabled": false,
      "message": "Panels Play is temporarily undergoing scheduled maintenance. Please check back shortly."
    },
    "emergency_disabled": false,
    "global_emergency_disabled": false,
    "user_message": null
  },
  "signature": {
    "algorithm": "ed25519",
    "public_key": "5910d52a21f0b0cac77dbf16abf5f1b61c98666308bac0807aa38898765bff50",
    "signature_hex": "3f46e130577e47b105b14a5a8ef677e25c3658a2654bced3eb9a68241dcb2b52b0ce595e5cff2ea4718da6db73511025fe3fe8813bc660db29840aa84a734f03"
  }
}
